{
  "documentType": "通知",
  "confidence": 0.98,
  "source": "host-agent",
  "inputSHA256": "3b22b3a326864957418fe7ae86d3862ab370c2857d310df857d17a87f96a73a8",
  "blocks": [
    {
      "id": 0,
      "role": "title",
      "confidence": 0.98,
      "rationale": "本次宿主 Agent 阅读完整样本后标注的验收结构；不是运行时识别规则。"
    },
    {
      "id": 1,
      "role": "recipient",
      "confidence": 0.98,
      "rationale": "本次宿主 Agent 阅读完整样本后标注的验收结构；不是运行时识别规则。"
    },
    {
      "id": 2,
      "role": "body",
      "confidence": 0.98,
      "rationale": "本次宿主 Agent 阅读完整样本后标注的验收结构；不是运行时识别规则。"
    },
    {
      "id": 3,
      "role": "unknown",
      "confidence": 0.98,
      "rationale": "本次宿主 Agent 阅读完整样本后标注的验收结构；不是运行时识别规则。"
    },
    {
      "id": 4,
      "role": "body",
      "confidence": 0.98,
      "rationale": "本次宿主 Agent 阅读完整样本后标注的验收结构；不是运行时识别规则。"
    },
    {
      "id": 5,
      "role": "unknown",
      "confidence": 0.98,
      "rationale": "本次宿主 Agent 阅读完整样本后标注的验收结构；不是运行时识别规则。"
    },
    {
      "id": 6,
      "role": "body",
      "confidence": 0.98,
      "rationale": "本次宿主 Agent 阅读完整样本后标注的验收结构；不是运行时识别规则。"
    }
  ],
  "warnings": [],
  "suggestions": []
}
