{
  "documentType": "通知",
  "confidence": 0.98,
  "source": "host-agent",
  "inputSHA256": "4ef9baf051baaa11193f24615dd6c32524532d3eb18ce2b763f87f128f5d2fd5",
  "blocks": [
    {
      "id": 0,
      "role": "title",
      "confidence": 0.98,
      "rationale": "本次宿主 Agent 阅读完整样本后标注的验收结构；不是运行时识别规则。"
    },
    {
      "id": 1,
      "role": "recipient",
      "confidence": 0.98,
      "rationale": "本次宿主 Agent 阅读完整样本后标注的验收结构；不是运行时识别规则。"
    },
    {
      "id": 2,
      "role": "body",
      "confidence": 0.98,
      "rationale": "本次宿主 Agent 阅读完整样本后标注的验收结构；不是运行时识别规则。"
    },
    {
      "id": 3,
      "role": "attachment_note",
      "confidence": 0.98,
      "rationale": "本次宿主 Agent 阅读完整样本后标注的验收结构；不是运行时识别规则。"
    },
    {
      "id": 4,
      "role": "issuer",
      "confidence": 0.98,
      "rationale": "本次宿主 Agent 阅读完整样本后标注的验收结构；不是运行时识别规则。"
    },
    {
      "id": 5,
      "role": "date",
      "confidence": 0.98,
      "rationale": "本次宿主 Agent 阅读完整样本后标注的验收结构；不是运行时识别规则。"
    },
    {
      "id": 6,
      "role": "annotation",
      "confidence": 0.98,
      "rationale": "本次宿主 Agent 阅读完整样本后标注的验收结构；不是运行时识别规则。"
    }
  ],
  "warnings": [],
  "suggestions": []
}
